21:11:29.202293 IP (tos 0x0, ttl 64, id 18921, offset 0, flags [DF], proto TCP (6), length 60)
    fedora.58288 > 45.64.132.239.https: Flags [S], cksum 0x736e (incorrect -> 0x9b77), seq 4059846603, win 64240, options [mss 1460,sackOK,TS val 3125105886 ecr 0,nop,wscale 7], length 0
21:11:29.272345 IP (tos 0x0, ttl 44, id 54542, offset 0, flags [DF], proto TCP (6), length 40)
    45.64.132.239.https > fedora.58288: Flags [R.], cksum 0x0d5c (correct), seq 0, ack 4059846604, win 0, length 0
21:11:29.272864 IP (tos 0x0, ttl 64, id 35641, offset 0, flags [DF], proto TCP (6), length 60)
    fedora.58290 > 45.64.132.239.https: Flags [S], cksum 0x736e (incorrect -> 0x6878), seq 3386028716, win 64240, options [mss 1460,sackOK,TS val 3125105956 ecr 0,nop,wscale 7], length 0
21:11:29.345941 IP (tos 0x0, ttl 44, id 54551, offset 0, flags [DF], proto TCP (6), length 40)
    45.64.132.239.https > fedora.58290: Flags [R.], cksum 0xdaa2 (correct), seq 0, ack 3386028717, win 0, length 0
21:11:29.350692 IP (tos 0x0, ttl 64, id 53551, offset 0, flags [DF], proto TCP (6), length 60)
    fedora.37172 > 45.64.132.239.http: Flags [S], cksum 0x736e (incorrect -> 0xcde5), seq 2079846069, win 64240, options [mss 1460,sackOK,TS val 3125106034 ecr 0,nop,wscale 7], length 0
21:11:29.374476 IP (tos 0x0, ttl 1, id 39167, offset 0, flags [DF], proto TCP (6), length 64)
    fedora.42362 > 45.64.132.239.hostmon: Flags [S], cksum 0x7372 (incorrect -> 0x709c), seq 3773270798, win 64240, options [mss 1460,sackOK,TS val 3125106058 ecr 0,nop,wscale 7,tfo  cookiereq,nop,nop], length 0
21:11:29.421653 IP (tos 0x0, ttl 47, id 0, offset 0, flags [DF], proto TCP (6), length 60)
    45.64.132.239.http > fedora.37172: Flags [S.], cksum 0x1572 (correct), seq 1988226146, ack 2079846070, win 28960, options [mss 1440,sackOK,TS val 3617785791 ecr 3125106034,nop,wscale 7], length 0
21:11:29.421687 IP (tos 0x0, ttl 64, id 53552, offset 0, flags [DF], proto TCP (6), length 52)
    fedora.37172 > 45.64.132.239.http: Flags [.], cksum 0x7366 (incorrect -> 0xb30d), ack 1, win 502, options [nop,nop,TS val 3125106105 ecr 3617785791], length 0
21:11:29.421804 IP (tos 0x0, ttl 64, id 53553, offset 0, flags [DF], proto TCP (6), length 427)
    fedora.37172 > 45.64.132.239.http: Flags [P.], cksum 0x74dd (incorrect -> 0x4c23), seq 1:376, ack 1, win 502, options [nop,nop,TS val 3125106105 ecr 3617785791], length 375: HTTP, length: 375
	GET /nu-web/applicantLogin.action HTTP/1.1
	Host: app55.nu.edu.bd
	User-Agent: Mozilla/5.0 (X11; Linux x86_64; rv:100.0) Gecko/20100101 Firefox/100.0
	Accept: text/html,application/xhtml+xml,application/xml;q=0.9,image/avif,image/webp,*/*;q=0.8
	Accept-Language: en-US,en;q=0.5
	Accept-Encoding: gzip, deflate
	DNT: 1
	Connection: keep-alive
	Upgrade-Insecure-Requests: 1
	
21:11:29.492631 IP (tos 0x0, ttl 47, id 58469, offset 0, flags [DF], proto TCP (6), length 52)
    45.64.132.239.http > fedora.37172: Flags [.], cksum 0xb25a (correct), ack 376, win 235, options [nop,nop,TS val 3617785862 ecr 3125106105], length 0
21:11:29.512826 IP (tos 0x0, ttl 47, id 58470, offset 0, flags [DF], proto TCP (6), length 1480)
    45.64.132.239.http > fedora.37172: Flags [.], cksum 0xeb0e (correct), seq 1:1429, ack 376, win 235, options [nop,nop,TS val 3617785880 ecr 3125106105], length 1428: HTTP, length: 1428
	HTTP/1.1 200 OK
	Date: Fri, 09 Feb 2024 15:19:29 GMT
	Server: Apache/2.4.23 (Unix)
	Set-Cookie: JSESSIONID=B2D48DA32468DA988CED767C71E668DE.node3; Path=/nu-web
	Content-Type: text/html
	Content-Length: 3901
	Keep-Alive: timeout=5, max=100
	Connection: Keep-Alive
	
	
	
	<!DOCTYPE HTML>
	<html lang="en-US">
	<head>
	    <link type="image/x-icon"  rel="icon"href="resources/img/nuLogo.png" />
	    <meta charset="UTF-8">
	    <meta name="viewport" content="initial-scale=1.0,maximum-scale=1.0,user-scalable=no" />
	    <link rel="icon" type="image/ico" href="favicon.ico">
	    <title>NU - Login</title>
	    <link rel="stylesheet" href="/nu-web/resources/css/login.css">
	    <link href='http://fonts.googleapis.com/css?family=Open+Sans+Condensed:300' rel='stylesheet'>
	    <!-- jQuery framework -->
	    <script src="/nu-web/resources/js/jquery.min.js"></script>
	    <!-- validation -->
	    <script src="/nu-web/resources/js/lib/jquery-validation/jquery.validate.js"></script>
	    <script type="text/javascript">
	        (function(a){a.fn.vAlign=function(){return this.each(function(){var b=a(this).height(),c=a(this).outerHeight(),b=(b+(c-b))/2;a(this).css("margin-top","-"+b+"px");a(this).css("top","50%");a(this).css("position","absolute")})}})(jQuery);(function(a){a.fn.hAlign=function(){return this.each(function(){var b=a(this).width(),c=a(this).outerWidth(),b=(b+(c-b))/2;a(this).css("margin-left","-"+b+"px");a(thi [|http]
21:11:29.512848 IP (tos 0x0, ttl 64, id 53554, offset 0, flags [DF], proto TCP (6), length 52)
    fedora.37172 > 45.64.132.239.http: Flags [.], cksum 0x7366 (incorrect -> 0xab4f), ack 1429, win 501, options [nop,nop,TS val 3125106196 ecr 3617785880], length 0
21:11:29.514009 IP (tos 0x0, ttl 47, id 58471, offset 0, flags [DF], proto TCP (6), length 1480)
    45.64.132.239.http > fedora.37172: Flags [.], cksum 0xb57c (correct), seq 1429:2857, ack 376, win 235, options [nop,nop,TS val 3617785880 ecr 3125106105], length 1428: HTTP
21:11:29.514026 IP (tos 0x0, ttl 64, id 53555, offset 0, flags [DF], proto TCP (6), length 52)
    fedora.37172 > 45.64.132.239.http: Flags [.], cksum 0x7366 (incorrect -> 0xa5b9), ack 2857, win 501, options [nop,nop,TS val 3125106198 ecr 3617785880], length 0
21:11:29.515423 IP (tos 0x0, ttl 47, id 58472, offset 0, flags [DF], proto TCP (6), length 1363)
    45.64.132.239.http > fedora.37172: Flags [P.], cksum 0x4233 (correct), seq 2857:4168, ack 376, win 235, options [nop,nop,TS val 3617785880 ecr 3125106105], length 1311: HTTP
21:11:29.515445 IP (tos 0x0, ttl 64, id 53556, offset 0, flags [DF], proto TCP (6), length 52)
    fedora.37172 > 45.64.132.239.http: Flags [.], cksum 0x7366 (incorrect -> 0xa099), ack 4168, win 501, options [nop,nop,TS val 3125106199 ecr 3617785880], length 0
21:11:29.526646 IP (tos 0x0, ttl 64, id 53557, offset 0, flags [DF], proto TCP (6), length 453)
    fedora.37172 > 45.64.132.239.http: Flags [P.], cksum 0x74f7 (incorrect -> 0xf323), seq 376:777, ack 4168, win 501, options [nop,nop,TS val 3125106210 ecr 3617785880], length 401: HTTP, length: 401
	GET /nu-web/resources/css/login.css HTTP/1.1
	Host: app55.nu.edu.bd
	User-Agent: Mozilla/5.0 (X11; Linux x86_64; rv:100.0) Gecko/20100101 Firefox/100.0
	Accept: text/css,*/*;q=0.1
	Accept-Language: en-US,en;q=0.5
	Accept-Encoding: gzip, deflate
	DNT: 1
	Connection: keep-alive
	Referer: http://app55.nu.edu.bd/nu-web/applicantLogin.action
	Cookie: JSESSIONID=B2D48DA32468DA988CED767C71E668DE.node3
	
21:11:29.530449 IP (tos 0x0, ttl 64, id 48063, offset 0, flags [DF], proto TCP (6), length 60)
    fedora.37174 > 45.64.132.239.http: Flags [S], cksum 0x736e (incorrect -> 0x067f), seq 827195408, win 64240, options [mss 1460,sackOK,TS val 3125106214 ecr 0,nop,wscale 7], length 0
21:11:29.530839 IP (tos 0x0, ttl 64, id 15219, offset 0, flags [DF], proto TCP (6), length 60)
    fedora.37176 > 45.64.132.239.http: Flags [S], cksum 0x736e (incorrect -> 0xb360), seq 333869204, win 64240, options [mss 1460,sackOK,TS val 3125106214 ecr 0,nop,wscale 7], length 0
21:11:29.531251 IP (tos 0x0, ttl 64, id 25636, offset 0, flags [DF], proto TCP (6), length 60)
    fedora.37178 > 45.64.132.239.http: Flags [S], cksum 0x736e (incorrect -> 0x53a0), seq 102555163, win 64240, options [mss 1460,sackOK,TS val 3125106215 ecr 0,nop,wscale 7], length 0
21:11:29.599650 IP (tos 0x0, ttl 47, id 58473, offset 0, flags [DF], proto TCP (6), length 1480)
    45.64.132.239.http > fedora.37172: Flags [.], cksum 0x933f (correct), seq 4168:5596, ack 777, win 243, options [nop,nop,TS val 3617785968 ecr 3125106210], length 1428: HTTP, length: 1428
	HTTP/1.1 200 OK
	Date: Fri, 09 Feb 2024 15:19:29 GMT
	Server: Apache/2.4.23 (Unix)
	Accept-Ranges: bytes
	ETag: W/"6498-1707206454000"
	Last-Modified: Tue, 06 Feb 2024 08:00:54 GMT
	Content-Type: text/css
	Content-Length: 6498
	Keep-Alive: timeout=5, max=99
	Connection: Keep-Alive
	
	/* reset */
	    html,body,div,span,applet,object,iframe,h1,h2,h3,h4,h5,h6,p,blockquote,pre,a,abbr,acronym,address,big,cite,code,del,dfn,em,img,ins,kbd,q,s,samp,small,strike,strong,sub,sup,tt,var,b,u,i,center,dl,dt,dd,ol,ul,li,fieldset,form,label,legend,table,caption,tbody,tfoot,thead,tr,th,td,article,aside,canvas,details,embed,figure,figcaption,footer,header,hgroup,menu,nav,output,ruby,section,summary,time,mark,audio,video{border:0;font-size:100%;font:inherit;vertical-align:baseline;margin:0;padding:0}article,aside,details,figcaption,figure,footer,header,hgroup,menu,nav,section{display:block}body{line-height:1}ol,ul{list-style:none}blockquote,q{quotes:none}blockquote:before,blockquote:after,q:before,q:after{content:none}table{border-collapse:collapse;border-spacing:0}
	    body {padding-top:40px;font-family: "Helvetica Neue", Helvetica, Arial, sans-serif;background: url(../img/patterns/bg_c.png)}
	    .clearfix { *zoom: 1 }
	    .clearfix:before,
	    .clearfix:after { display: table; line-height: 0; content: ""; }
	    .clearfix:after { clear: both }
	    a {color:#368CA9;text-decoration:none}
	    a:hover {text-decoration: [|http]
21:11:29.599671 IP (tos 0x0, ttl 64, id 53558, offset 0, flags [DF], proto TCP (6), length 52)
    fedora.37172 > 45.64.132.239.http: Flags [.], cksum 0x7366 (incorrect -> 0x98c8), ack 5596, win 501, options [nop,nop,TS val 3125106283 ecr 3617785968], length 0
21:11:29.600863 IP (tos 0x0, ttl 47, id 58474, offset 0, flags [DF], proto TCP (6), length 1480)
    45.64.132.239.http > fedora.37172: Flags [.], cksum 0x9d93 (correct), seq 5596:7024, ack 777, win 243, options [nop,nop,TS val 3617785968 ecr 3125106210], length 1428: HTTP
21:11:29.600869 IP (tos 0x0, ttl 64, id 53559, offset 0, flags [DF], proto TCP (6), length 52)
    fedora.37172 > 45.64.132.239.http: Flags [.], cksum 0x7366 (incorrect -> 0x9333), ack 7024, win 501, options [nop,nop,TS val 3125106284 ecr 3617785968], length 0
21:11:29.602077 IP (tos 0x0, ttl 47, id 58475, offset 0, flags [DF], proto TCP (6), length 1480)
    45.64.132.239.http > fedora.37172: Flags [.], cksum 0x9089 (correct), seq 7024:8452, ack 777, win 243, options [nop,nop,TS val 3617785968 ecr 3125106210], length 1428: HTTP
21:11:29.602081 IP (tos 0x0, ttl 64, id 53560, offset 0, flags [DF], proto TCP (6), length 52)
    fedora.37172 > 45.64.132.239.http: Flags [.], cksum 0x7366 (incorrect -> 0x8d9d), ack 8452, win 501, options [nop,nop,TS val 3125106286 ecr 3617785968], length 0
21:11:29.603291 IP (tos 0x0, ttl 47, id 58476, offset 0, flags [DF], proto TCP (6), length 1480)
    45.64.132.239.http > fedora.37172: Flags [.], cksum 0x4c3f (correct), seq 8452:9880, ack 777, win 243, options [nop,nop,TS val 3617785968 ecr 3125106210], length 1428: HTTP
21:11:29.603295 IP (tos 0x0, ttl 64, id 53561, offset 0, flags [DF], proto TCP (6), length 52)
    fedora.37172 > 45.64.132.239.http: Flags [.], cksum 0x7366 (incorrect -> 0x8808), ack 9880, win 501, options [nop,nop,TS val 3125106287 ecr 3617785968], length 0
21:11:29.604219 IP (tos 0x0, ttl 47, id 58477, offset 0, flags [DF], proto TCP (6), length 1123)
    45.64.132.239.http > fedora.37172: Flags [P.], cksum 0x5b7e (correct), seq 9880:10951, ack 777, win 243, options [nop,nop,TS val 3617785968 ecr 3125106210], length 1071: HTTP
21:11:29.604222 IP (tos 0x0, ttl 64, id 53562, offset 0, flags [DF], proto TCP (6), length 52)
    fedora.37172 > 45.64.132.239.http: Flags [.], cksum 0x7366 (incorrect -> 0x83d8), ack 10951, win 501, options [nop,nop,TS val 3125106288 ecr 3617785968], length 0
21:11:29.604295 IP (tos 0x0, ttl 44, id 0, offset 0, flags [DF], proto TCP (6), length 60)
    45.64.132.239.http > fedora.37178: Flags [S.], cksum 0x0309 (correct), seq 1244180523, ack 102555164, win 28960, options [mss 1440,sackOK,TS val 3617785971 ecr 3125106215,nop,wscale 7], length 0
21:11:29.604306 IP (tos 0x0, ttl 64, id 25637, offset 0, flags [DF], proto TCP (6), length 52)
    fedora.37178 > 45.64.132.239.http: Flags [.], cksum 0x7366 (incorrect -> 0xa0a2), ack 1, win 502, options [nop,nop,TS val 3125106288 ecr 3617785971], length 0
21:11:29.604373 IP (tos 0x0, ttl 47, id 0, offset 0, flags [DF], proto TCP (6), length 60)
    45.64.132.239.http > fedora.37174: Flags [S.], cksum 0x6607 (correct), seq 2275066521, ack 827195409, win 28960, options [mss 1440,sackOK,TS val 3617785971 ecr 3125106214,nop,wscale 7], length 0
21:11:29.604378 IP (tos 0x0, ttl 64, id 48064, offset 0, flags [DF], proto TCP (6), length 52)
    fedora.37174 > 45.64.132.239.http: Flags [.], cksum 0x7366 (incorrect -> 0x03a0), ack 1, win 502, options [nop,nop,TS val 3125106288 ecr 3617785971], length 0
21:11:29.604408 IP (tos 0x0, ttl 64, id 25638, offset 0, flags [DF], proto TCP (6), length 468)
    fedora.37178 > 45.64.132.239.http: Flags [P.], cksum 0x7506 (incorrect -> 0x51f0), seq 1:417, ack 1, win 502, options [nop,nop,TS val 3125106288 ecr 3617785971], length 416: HTTP, length: 416
	GET /nu-web/resources/js/lib/jquery-validation/jquery.validate.js HTTP/1.1
	Host: app55.nu.edu.bd
	User-Agent: Mozilla/5.0 (X11; Linux x86_64; rv:100.0) Gecko/20100101 Firefox/100.0
	Accept: */*
	Accept-Language: en-US,en;q=0.5
	Accept-Encoding: gzip, deflate
	DNT: 1
	Connection: keep-alive
	Referer: http://app55.nu.edu.bd/nu-web/applicantLogin.action
	Cookie: JSESSIONID=B2D48DA32468DA988CED767C71E668DE.node3
	
21:11:29.604450 IP (tos 0x0, ttl 44, id 0, offset 0, flags [DF], proto TCP (6), length 60)
    45.64.132.239.http > fedora.37176: Flags [S.], cksum 0x4881 (correct), seq 66850976, ack 333869205, win 28960, options [mss 1440,sackOK,TS val 3617785971 ecr 3125106214,nop,wscale 7], length 0
21:11:29.604455 IP (tos 0x0, ttl 64, id 15220, offset 0, flags [DF], proto TCP (6), length 52)
    fedora.37176 > 45.64.132.239.http: Flags [.], cksum 0x7366 (incorrect -> 0xe619), ack 1, win 502, options [nop,nop,TS val 3125106288 ecr 3617785971], length 0
21:11:29.604469 IP (tos 0x0, ttl 64, id 48065, offset 0, flags [DF], proto TCP (6), length 441)
    fedora.37174 > 45.64.132.239.http: Flags [P.], cksum 0x74eb (incorrect -> 0x312a), seq 1:390, ack 1, win 502, options [nop,nop,TS val 3125106288 ecr 3617785971], length 389: HTTP, length: 389
	GET /nu-web/resources/js/jquery.min.js HTTP/1.1
	Host: app55.nu.edu.bd
	User-Agent: Mozilla/5.0 (X11; Linux x86_64; rv:100.0) Gecko/20100101 Firefox/100.0
	Accept: */*
	Accept-Language: en-US,en;q=0.5
	Accept-Encoding: gzip, deflate
	DNT: 1
	Connection: keep-alive
	Referer: http://app55.nu.edu.bd/nu-web/applicantLogin.action
	Cookie: JSESSIONID=B2D48DA32468DA988CED767C71E668DE.node3
	
21:11:29.674598 IP (tos 0x0, ttl 44, id 47249, offset 0, flags [DF], proto TCP (6), length 52)
    45.64.132.239.http > fedora.37178: Flags [.], cksum 0x9fc3 (correct), ack 417, win 235, options [nop,nop,TS val 3617786045 ecr 3125106288], length 0
21:11:29.675299 IP (tos 0x0, ttl 47, id 51748, offset 0, flags [DF], proto TCP (6), length 52)
    45.64.132.239.http > fedora.37174: Flags [.], cksum 0x02db (correct), ack 390, win 235, options [nop,nop,TS val 3617786046 ecr 3125106288], length 0
21:11:29.677077 IP (tos 0x0, ttl 44, id 47250, offset 0, flags [DF], proto TCP (6), length 1480)
    45.64.132.239.http > fedora.37178: Flags [.], cksum 0x76d6 (correct), seq 1:1429, ack 417, win 235, options [nop,nop,TS val 3617786046 ecr 3125106288], length 1428: HTTP, length: 1428
	HTTP/1.1 200 OK
	Date: Fri, 09 Feb 2024 15:19:29 GMT
	Server: Apache/2.4.23 (Unix)
	Accept-Ranges: bytes
	ETag: W/"40581-1707206480000"
	Last-Modified: Tue, 06 Feb 2024 08:01:20 GMT
	Content-Type: application/javascript
	Content-Length: 40581
	Keep-Alive: timeout=5, max=100
	Connection: Keep-Alive
	
	/**
	 * jQuery Validation Plugin 1.11.0pre
	 *
	 * http://bassistance.de/jquery-plugins/jquery-plugin-validation/
	 * http://docs.jquery.com/Plugins/Validation
	 *
21:11:29.677094 IP (tos 0x0, ttl 64, id 25639, offset 0, flags [DF], proto TCP (6), length 52)
    fedora.37178 > 45.64.132.239.http: Flags [.], cksum 0x7366 (incorrect -> 0x98db), ack 1429, win 501, options [nop,nop,TS val 3125106361 ecr 3617786046], length 0
21:11:29.678296 IP (tos 0x0, ttl 44, id 47251, offset 0, flags [DF], proto TCP (6), length 1480)
    45.64.132.239.http > fedora.37178: Flags [.], cksum 0xf980 (correct), seq 1429:2857, ack 417, win 235, options [nop,nop,TS val 3617786046 ecr 3125106288], length 1428: HTTP
21:11:29.678308 IP (tos 0x0, ttl 64, id 25640, offset 0, flags [DF], proto TCP (6), length 52)
    fedora.37178 > 45.64.132.239.http: Flags [.], cksum 0x7366 (incorrect -> 0x9346), ack 2857, win 501, options [nop,nop,TS val 3125106362 ecr 3617786046], length 0
21:11:29.679501 IP (tos 0x0, ttl 44, id 47252, offset 0, flags [DF], proto TCP (6), length 1480)
    45.64.132.239.http > fedora.37178: Flags [.], cksum 0x0f31 (correct), seq 2857:4285, ack 417, win 235, options [nop,nop,TS val 3617786046 ecr 3125106288], length 1428: HTTP
21:11:29.679513 IP (tos 0x0, ttl 64, id 25641, offset 0, flags [DF], proto TCP (6), length 52)
    fedora.37178 > 45.64.132.239.http: Flags [.], cksum 0x7366 (incorrect -> 0x8db1), ack 4285, win 501, options [nop,nop,TS val 3125106363 ecr 3617786046], length 0
21:11:29.680718 IP (tos 0x0, ttl 44, id 47254, offset 0, flags [DF], proto TCP (6), length 1480)
    45.64.132.239.http > fedora.37178: Flags [.], cksum 0xcdb2 (correct), seq 5713:7141, ack 417, win 235, options [nop,nop,TS val 3617786046 ecr 3125106288], length 1428: HTTP
21:11:29.680730 IP (tos 0x0, ttl 64, id 25642, offset 0, flags [DF], proto TCP (6), length 64)
    fedora.37178 > 45.64.132.239.http: Flags [.], cksum 0x7372 (incorrect -> 0x30bb), ack 4285, win 501, options [nop,nop,TS val 3125106364 ecr 3617786046,nop,nop,sack 1 {5713:7141}], length 0
21:11:29.681932 IP (tos 0x0, ttl 44, id 47253, offset 0, flags [DF], proto TCP (6), length 1480)
    45.64.132.239.http > fedora.37178: Flags [.], cksum 0xc681 (correct), seq 4285:5713, ack 417, win 235, options [nop,nop,TS val 3617786046 ecr 3125106288], length 1428: HTTP
21:11:29.681949 IP (tos 0x0, ttl 64, id 25643, offset 0, flags [DF], proto TCP (6), length 52)
    fedora.37178 > 45.64.132.239.http: Flags [.], cksum 0x7366 (incorrect -> 0x828c), ack 7141, win 495, options [nop,nop,TS val 3125106366 ecr 3617786046], length 0
21:11:29.683147 IP (tos 0x0, ttl 44, id 47258, offset 0, flags [DF], proto TCP (6), length 1480)
    45.64.132.239.http > fedora.37178: Flags [.], cksum 0xd8e7 (correct), seq 11343:12771, ack 417, win 235, options [nop,nop,TS val 3617786047 ecr 3125106288], length 1428: HTTP
21:11:29.683159 IP (tos 0x0, ttl 64, id 25644, offset 0, flags [DF], proto TCP (6), length 64)
    fedora.37178 > 45.64.132.239.http: Flags [.], cksum 0x7372 (incorrect -> 0xf993), ack 7141, win 501, options [nop,nop,TS val 3125106367 ecr 3617786046,nop,nop,sack 1 {11343:12771}], length 0
21:11:29.684302 IP (tos 0x0, ttl 44, id 47255, offset 0, flags [DF], proto TCP (6), length 1398)
    45.64.132.239.http > fedora.37178: Flags [P.], cksum 0x560a (correct), seq 7141:8487, ack 417, win 235, options [nop,nop,TS val 3617786046 ecr 3125106288], length 1346: HTTP
21:11:29.684318 IP (tos 0x0, ttl 64, id 25645, offset 0, flags [DF], proto TCP (6), length 64)
    fedora.37178 > 45.64.132.239.http: Flags [.], cksum 0x7372 (incorrect -> 0xf455), ack 8487, win 496, options [nop,nop,TS val 3125106368 ecr 3617786046,nop,nop,sack 1 {11343:12771}], length 0
21:11:29.685510 IP (tos 0x0, ttl 44, id 47256, offset 0, flags [DF], proto TCP (6), length 1480)
    45.64.132.239.http > fedora.37178: Flags [.], cksum 0xb372 (correct), seq 8487:9915, ack 417, win 235, options [nop,nop,TS val 3617786047 ecr 3125106288], length 1428: HTTP
21:11:29.685526 IP (tos 0x0, ttl 64, id 25646, offset 0, flags [DF], proto TCP (6), length 64)
    fedora.37178 > 45.64.132.239.http: Flags [.], cksum 0x7372 (incorrect -> 0xeec0), ack 9915, win 495, options [nop,nop,TS val 3125106369 ecr 3617786047,nop,nop,sack 1 {11343:12771}], length 0
21:11:29.686725 IP (tos 0x0, ttl 47, id 51749, offset 0, flags [DF], proto TCP (6), length 1480)
    45.64.132.239.http > fedora.37174: Flags [.], cksum 0x7264 (correct), seq 1:1429, ack 390, win 235, options [nop,nop,TS val 3617786047 ecr 3125106288], length 1428: HTTP, length: 1428
	HTTP/1.1 200 OK
	Date: Fri, 09 Feb 2024 15:19:29 GMT
	Server: Apache/2.4.23 (Unix)
	Accept-Ranges: bytes
	ETag: W/"93637-1707206462000"
	Last-Modified: Tue, 06 Feb 2024 08:01:02 GMT
	Content-Type: application/javascript
	Content-Length: 93637
	Keep-Alive: timeout=5, max=100
	Connection: Keep-Alive
	
	/*! jQuery v1.8.3 jquery.com | jquery.org/license */
	(function(e,t){function _(e){var t=M[e]={};return v.each(e.split(y),function(e,n){t[n]=!0}),t}function H(e,n,r){if(r===t&&e.nodeType===1){var i="data-"+n.replace(P,"-$1").toLowerCase();r=e.getAttribute(i);if(typeof r=="string"){try{r=r==="true"?!0:r==="false"?!1:r==="null"?null:+r+""===r?+r:D.test(r)?v.parseJSON(r):r}catch(s){}v.data(e,n,r)}else r=t}return r}function B(e){var t;for(t in e){if(t==="data"&&v.isEmptyObject(e[t]))continue;if(t!=="toJSON")return!1}return!0}function et(){return!1}function tt(){return!0}function ut(e){return!e||!e.parentNode||e.parentNode.nodeType===11}function at(e,t){do e=e[t];while(e&&e.nodeType!==1);return e}function ft(e,t,n){t=t||0;if(v.isFunction(t))return v.grep(e,function(e,r){var i=!!t.call(e,r,e);return i===n});if(t.nodeType)return v.grep(e,function(e,r){return e===t===n});if(typeof t=="string"){var r=v.grep(e,function(e){return e.nodeType===1});if(it.test(t))return v.filter(t,r,!n);t=v.filter(t,r)}return v.grep(e,function(e,r){return v.inArray(e,t)>=0===n})}function lt(e){var t=ct.split("|"),n=e.createDocumentFragment [|http]
21:11:29.686737 IP (tos 0x0, ttl 64, id 48066, offset 0, flags [DF], proto TCP (6), length 52)
    fedora.37174 > 45.64.132.239.http: Flags [.], cksum 0x7366 (incorrect -> 0xfbe9), ack 1429, win 501, options [nop,nop,TS val 3125106370 ecr 3617786047], length 0
21:11:29.687940 IP (tos 0x0, ttl 44, id 47257, offset 0, flags [DF], proto TCP (6), length 1480)
    45.64.132.239.http > fedora.37178: Flags [.], cksum 0x7bae (correct), seq 9915:11343, ack 417, win 235, options [nop,nop,TS val 3617786047 ecr 3125106288], length 1428: HTTP
21:11:29.687955 IP (tos 0x0, ttl 64, id 25647, offset 0, flags [DF], proto TCP (6), length 52)
    fedora.37178 > 45.64.132.239.http: Flags [.], cksum 0x7366 (incorrect -> 0x6c87), ack 12771, win 495, options [nop,nop,TS val 3125106372 ecr 3617786047], length 0
21:11:29.689155 IP (tos 0x0, ttl 44, id 47259, offset 0, flags [DF], proto TCP (6), length 1480)
    45.64.132.239.http > fedora.37178: Flags [.], cksum 0x9685 (correct), seq 12771:14199, ack 417, win 235, options [nop,nop,TS val 3617786047 ecr 3125106288], length 1428: HTTP
21:11:29.689166 IP (tos 0x0, ttl 64, id 25648, offset 0, flags [DF], proto TCP (6), length 52)
    fedora.37178 > 45.64.132.239.http: Flags [.], cksum 0x7366 (incorrect -> 0x66ec), ack 14199, win 501, options [nop,nop,TS val 3125106373 ecr 3617786047], length 0
21:11:29.690306 IP (tos 0x0, ttl 47, id 51750, offset 0, flags [DF], proto TCP (6), length 1480)
    45.64.132.239.http > fedora.37174: Flags [.], cksum 0x0c36 (correct), seq 1429:2857, ack 390, win 235, options [nop,nop,TS val 3617786047 ecr 3125106288], length 1428: HTTP
21:11:29.690317 IP (tos 0x0, ttl 64, id 48067, offset 0, flags [DF], proto TCP (6), length 52)
    fedora.37174 > 45.64.132.239.http: Flags [.], cksum 0x7366 (incorrect -> 0xf651), ack 2857, win 501, options [nop,nop,TS val 3125106374 ecr 3617786047], length 0
21:11:29.691582 IP (tos 0x0, ttl 47, id 51751, offset 0, flags [DF], proto TCP (6), length 1480)
    45.64.132.239.http > fedora.37174: Flags [.], cksum 0x2da9 (correct), seq 2857:4285, ack 390, win 235, options [nop,nop,TS val 3617786047 ecr 3125106288], length 1428: HTTP
21:11:29.691594 IP (tos 0x0, ttl 64, id 48068, offset 0, flags [DF], proto TCP (6), length 52)
    fedora.37174 > 45.64.132.239.http: Flags [.], cksum 0x7366 (incorrect -> 0xf0bc), ack 4285, win 501, options [nop,nop,TS val 3125106375 ecr 3617786047], length 0
21:11:29.692749 IP (tos 0x0, ttl 47, id 51752, offset 0, flags [DF], proto TCP (6), length 1480)
    45.64.132.239.http > fedora.37174: Flags [.], cksum 0x7507 (correct), seq 4285:5713, ack 390, win 235, options [nop,nop,TS val 3617786047 ecr 3125106288], length 1428: HTTP
21:11:29.692761 IP (tos 0x0, ttl 64, id 48069, offset 0, flags [DF], proto TCP (6), length 52)
    fedora.37174 > 45.64.132.239.http: Flags [.], cksum 0x7366 (incorrect -> 0xeb27), ack 5713, win 501, options [nop,nop,TS val 3125106376 ecr 3617786047], length 0
21:11:29.693963 IP (tos 0x0, ttl 47, id 51753, offset 0, flags [DF], proto TCP (6), length 1480)
    45.64.132.239.http > fedora.37174: Flags [.], cksum 0xdd9e (correct), seq 5713:7141, ack 390, win 235, options [nop,nop,TS val 3617786047 ecr 3125106288], length 1428: HTTP
21:11:29.693974 IP (tos 0x0, ttl 64, id 48070, offset 0, flags [DF], proto TCP (6), length 52)
    fedora.37174 > 45.64.132.239.http: Flags [.], cksum 0x7366 (incorrect -> 0xe591), ack 7141, win 501, options [nop,nop,TS val 3125106378 ecr 3617786047], length 0
21:11:29.695083 IP (tos 0x0, ttl 47, id 51754, offset 0, flags [DF], proto TCP (6), length 1398)
    45.64.132.239.http > fedora.37174: Flags [P.], cksum 0x08d0 (correct), seq 7141:8487, ack 390, win 235, options [nop,nop,TS val 3617786047 ecr 3125106288], length 1346: HTTP
21:11:29.695092 IP (tos 0x0, ttl 64, id 48071, offset 0, flags [DF], proto TCP (6), length 52)
    fedora.37174 > 45.64.132.239.http: Flags [.], cksum 0x7366 (incorrect -> 0xe04e), ack 8487, win 501, options [nop,nop,TS val 3125106379 ecr 3617786047], length 0
21:11:29.696326 IP (tos 0x0, ttl 47, id 51755, offset 0, flags [DF], proto TCP (6), length 1480)
    45.64.132.239.http > fedora.37174: Flags [.], cksum 0x2048 (correct), seq 8487:9915, ack 390, win 235, options [nop,nop,TS val 3617786047 ecr 3125106288], length 1428: HTTP
21:11:29.696337 IP (tos 0x0, ttl 64, id 48072, offset 0, flags [DF], proto TCP (6), length 52)
    fedora.37174 > 45.64.132.239.http: Flags [.], cksum 0x7366 (incorrect -> 0xdab9), ack 9915, win 501, options [nop,nop,TS val 3125106380 ecr 3617786047], length 0
21:11:29.697513 IP (tos 0x0, ttl 47, id 51757, offset 0, flags [DF], proto TCP (6), length 1480)
    45.64.132.239.http > fedora.37174: Flags [.], cksum 0xae54 (correct), seq 11343:12771, ack 390, win 235, options [nop,nop,TS val 3617786047 ecr 3125106288], length 1428: HTTP
21:11:29.697525 IP (tos 0x0, ttl 64, id 48073, offset 0, flags [DF], proto TCP (6), length 64)
    fedora.37174 > 45.64.132.239.http: Flags [.], cksum 0x7372 (incorrect -> 0xb206), ack 9915, win 501, options [nop,nop,TS val 3125106381 ecr 3617786047,nop,nop,sack 1 {11343:12771}], length 0
21:11:29.698755 IP (tos 0x0, ttl 47, id 51756, offset 0, flags [DF], proto TCP (6), length 1480)
    45.64.132.239.http > fedora.37174: Flags [.], cksum 0xca02 (correct), seq 9915:11343, ack 390, win 235, options [nop,nop,TS val 3617786047 ecr 3125106288], length 1428: HTTP
21:11:29.698771 IP (tos 0x0, ttl 64, id 48074, offset 0, flags [DF], proto TCP (6), length 52)
    fedora.37174 > 45.64.132.239.http: Flags [.], cksum 0x7366 (incorrect -> 0xcf95), ack 12771, win 495, options [nop,nop,TS val 3125106382 ecr 3617786047], length 0
21:11:29.699972 IP (tos 0x0, ttl 47, id 51758, offset 0, flags [DF], proto TCP (6), length 1480)
    45.64.132.239.http > fedora.37174: Flags [.], cksum 0x34c5 (correct), seq 12771:14199, ack 390, win 235, options [nop,nop,TS val 3617786047 ecr 3125106288], length 1428: HTTP
21:11:29.699984 IP (tos 0x0, ttl 64, id 48075, offset 0, flags [DF], proto TCP (6), length 52)
    fedora.37174 > 45.64.132.239.http: Flags [.], cksum 0x7366 (incorrect -> 0xc9f9), ack 14199, win 501, options [nop,nop,TS val 3125106384 ecr 3617786047], length 0
21:11:29.749182 IP (tos 0x0, ttl 44, id 47260, offset 0, flags [DF], proto TCP (6), length 1480)
    45.64.132.239.http > fedora.37178: Flags [.], cksum 0x64e1 (correct), seq 14199:15627, ack 417, win 235, options [nop,nop,TS val 3617786118 ecr 3125106361], length 1428: HTTP
21:11:29.749238 IP (tos 0x0, ttl 64, id 25649, offset 0, flags [DF], proto TCP (6), length 52)
    fedora.37178 > 45.64.132.239.http: Flags [.], cksum 0x7366 (incorrect -> 0x60d5), ack 15627, win 501, options [nop,nop,TS val 3125106433 ecr 3617786118], length 0
21:11:29.750384 IP (tos 0x0, ttl 44, id 47261, offset 0, flags [DF], proto TCP (6), length 1480)
    45.64.132.239.http > fedora.37178: Flags [.], cksum 0x6dcb (correct), seq 15627:17055, ack 417, win 235, options [nop,nop,TS val 3617786118 ecr 3125106361], length 1428: HTTP
21:11:29.750426 IP (tos 0x0, ttl 64, id 25650, offset 0, flags [DF], proto TCP (6), length 52)
    fedora.37178 > 45.64.132.239.http: Flags [.], cksum 0x7366 (incorrect -> 0x5b40), ack 17055, win 501, options [nop,nop,TS val 3125106434 ecr 3617786118], length 0
21:11:29.752365 IP (tos 0x0, ttl 44, id 47262, offset 0, flags [DF], proto TCP (6), length 1480)
    45.64.132.239.http > fedora.37178: Flags [.], cksum 0x755d (correct), seq 17055:18483, ack 417, win 235, options [nop,nop,TS val 3617786122 ecr 3125106362], length 1428: HTTP
21:11:29.752403 IP (tos 0x0, ttl 64, id 25651, offset 0, flags [DF], proto TCP (6), length 52)
    fedora.37178 > 45.64.132.239.http: Flags [.], cksum 0x7366 (incorrect -> 0x55a6), ack 18483, win 501, options [nop,nop,TS val 3125106436 ecr 3617786122], length 0
21:11:29.753579 IP (tos 0x0, ttl 44, id 47263, offset 0, flags [DF], proto TCP (6), length 1480)
    45.64.132.239.http > fedora.37178: Flags [.], cksum 0x1a1e (correct), seq 18483:19911, ack 417, win 235, options [nop,nop,TS val 3617786122 ecr 3125106362], length 1428: HTTP
21:11:29.753617 IP (tos 0x0, ttl 64, id 25652, offset 0, flags [DF], proto TCP (6), length 52)
    fedora.37178 > 45.64.132.239.http: Flags [.], cksum 0x7366 (incorrect -> 0x5011), ack 19911, win 501, options [nop,nop,TS val 3125106437 ecr 3617786122], length 0
21:11:29.754775 IP (tos 0x0, ttl 44, id 47264, offset 0, flags [DF], proto TCP (6), length 1480)
    45.64.132.239.http > fedora.37178: Flags [.], cksum 0xd2a2 (correct), seq 19911:21339, ack 417, win 235, options [nop,nop,TS val 3617786122 ecr 3125106363], length 1428: HTTP
21:11:29.754784 IP (tos 0x0, ttl 64, id 25653, offset 0, flags [DF], proto TCP (6), length 52)
    fedora.37178 > 45.64.132.239.http: Flags [.], cksum 0x7366 (incorrect -> 0x4a7c), ack 21339, win 501, options [nop,nop,TS val 3125106438 ecr 3617786122], length 0
21:11:29.755983 IP (tos 0x0, ttl 44, id 47265, offset 0, flags [DF], proto TCP (6), length 1480)
    45.64.132.239.http > fedora.37178: Flags [.], cksum 0x953d (correct), seq 21339:22767, ack 417, win 235, options [nop,nop,TS val 3617786122 ecr 3125106363], length 1428: HTTP
21:11:29.755991 IP (tos 0x0, ttl 64, id 25654, offset 0, flags [DF], proto TCP (6), length 52)
    fedora.37178 > 45.64.132.239.http: Flags [.], cksum 0x7366 (incorrect -> 0x44e6), ack 22767, win 501, options [nop,nop,TS val 3125106440 ecr 3617786122], length 0
21:11:29.760050 IP (tos 0x0, ttl 44, id 47266, offset 0, flags [DF], proto TCP (6), length 1480)
    45.64.132.239.http > fedora.37178: Flags [.], cksum 0xf66a (correct), seq 22767:24195, ack 417, win 235, options [nop,nop,TS val 3617786129 ecr 3125106364], length 1428: HTTP
21:11:29.761297 IP (tos 0x0, ttl 44, id 47267, offset 0, flags [DF], proto TCP (6), length 1480)
    45.64.132.239.http > fedora.37178: Flags [.], cksum 0xa569 (correct), seq 24195:25623, ack 417, win 235, options [nop,nop,TS val 3617786129 ecr 3125106366], length 1428: HTTP
21:11:29.761339 IP (tos 0x0, ttl 64, id 25655, offset 0, flags [DF], proto TCP (6), length 52)
    fedora.37178 > 45.64.132.239.http: Flags [.], cksum 0x7366 (incorrect -> 0x39b2), ack 25623, win 501, options [nop,nop,TS val 3125106445 ecr 3617786129], length 0
21:11:29.762512 IP (tos 0x0, ttl 44, id 47268, offset 0, flags [DF], proto TCP (6), length 1480)
    45.64.132.239.http > fedora.37178: Flags [.], cksum 0x4852 (correct), seq 25623:27051, ack 417, win 235, options [nop,nop,TS val 3617786129 ecr 3125106366], length 1428: HTTP
21:11:29.763727 IP (tos 0x0, ttl 47, id 51759, offset 0, flags [DF], proto TCP (6), length 1480)
    45.64.132.239.http > fedora.37174: Flags [.], cksum 0x580a (correct), seq 14199:15627, ack 390, win 235, options [nop,nop,TS val 3617786129 ecr 3125106370], length 1428: HTTP
21:11:29.763769 IP (tos 0x0, ttl 64, id 48076, offset 0, flags [DF], proto TCP (6), length 52)
    fedora.37174 > 45.64.132.239.http: Flags [.], cksum 0x7366 (incorrect -> 0xc3d4), ack 15627, win 501, options [nop,nop,TS val 3125106447 ecr 3617786129], length 0
21:11:29.764941 IP (tos 0x0, ttl 47, id 51760, offset 0, flags [DF], proto TCP (6), length 1480)
    45.64.132.239.http > fedora.37174: Flags [.], cksum 0x7bc9 (correct), seq 15627:17055, ack 390, win 235, options [nop,nop,TS val 3617786129 ecr 3125106370], length 1428: HTTP
21:11:29.764983 IP (tos 0x0, ttl 64, id 48077, offset 0, flags [DF], proto TCP (6), length 52)
    fedora.37174 > 45.64.132.239.http: Flags [.], cksum 0x7366 (incorrect -> 0xbe3e), ack 17055, win 501, options [nop,nop,TS val 3125106449 ecr 3617786129], length 0
21:11:29.766155 IP (tos 0x0, ttl 44, id 47270, offset 0, flags [DF], proto TCP (6), length 1480)
    45.64.132.239.http > fedora.37178: Flags [.], cksum 0x7023 (correct), seq 28479:29907, ack 417, win 235, options [nop,nop,TS val 3617786129 ecr 3125106367], length 1428: HTTP
21:11:29.766199 IP (tos 0x0, ttl 64, id 25656, offset 0, flags [DF], proto TCP (6), length 64)
    fedora.37178 > 45.64.132.239.http: Flags [.], cksum 0x7372 (incorrect -> 0x2547), ack 27051, win 501, options [nop,nop,TS val 3125106450 ecr 3617786129,nop,nop,sack 1 {28479:29907}], length 0
21:11:29.767369 IP (tos 0x0, ttl 44, id 47269, offset 0, flags [DF], proto TCP (6), length 1480)
    45.64.132.239.http > fedora.37178: Flags [.], cksum 0xf04b (correct), seq 27051:28479, ack 417, win 235, options [nop,nop,TS val 3617786129 ecr 3125106367], length 1428: HTTP
21:11:29.767427 IP (tos 0x0, ttl 64, id 25657, offset 0, flags [DF], proto TCP (6), length 52)
    fedora.37178 > 45.64.132.239.http: Flags [.], cksum 0x7366 (incorrect -> 0x28f6), ack 29907, win 495, options [nop,nop,TS val 3125106451 ecr 3617786129], length 0
21:11:29.768588 IP (tos 0x0, ttl 47, id 51761, offset 0, flags [DF], proto TCP (6), length 1480)
    45.64.132.239.http > fedora.37174: Flags [.], cksum 0x5816 (correct), seq 17055:18483, ack 390, win 235, options [nop,nop,TS val 3617786130 ecr 3125106374], length 1428: HTTP
21:11:29.768630 IP (tos 0x0, ttl 64, id 48078, offset 0, flags [DF], proto TCP (6), length 52)
    fedora.37174 > 45.64.132.239.http: Flags [.], cksum 0x7366 (incorrect -> 0xb8a6), ack 18483, win 501, options [nop,nop,TS val 3125106452 ecr 3617786130], length 0
21:11:29.769798 IP (tos 0x0, ttl 44, id 47272, offset 0, flags [DF], proto TCP (6), length 1480)
    45.64.132.239.http > fedora.37178: Flags [.], cksum 0x34f0 (correct), seq 31335:32763, ack 417, win 235, options [nop,nop,TS val 3617786129 ecr 3125106373], length 1428: HTTP
21:11:29.769841 IP (tos 0x0, ttl 64, id 25658, offset 0, flags [DF], proto TCP (6), length 64)
    fedora.37178 > 45.64.132.239.http: Flags [.], cksum 0x7372 (incorrect -> 0x03cc), ack 29907, win 501, options [nop,nop,TS val 3125106453 ecr 3617786129,nop,nop,sack 1 {31335:32763}], length 0
21:11:29.771012 IP (tos 0x0, ttl 44, id 47271, offset 0, flags [DF], proto TCP (6), length 1480)
    45.64.132.239.http > fedora.37178: Flags [.], cksum 0x06d6 (correct), seq 29907:31335, ack 417, win 235, options [nop,nop,TS val 3617786129 ecr 3125106373], length 1428: HTTP
21:11:29.771070 IP (tos 0x0, ttl 64, id 25659, offset 0, flags [DF], proto TCP (6), length 52)
    fedora.37178 > 45.64.132.239.http: Flags [.], cksum 0x7366 (incorrect -> 0x1dca), ack 32763, win 495, options [nop,nop,TS val 3125106455 ecr 3617786129], length 0
21:11:29.772245 IP (tos 0x0, ttl 44, id 47273, offset 0, flags [DF], proto TCP (6), length 1480)
    45.64.132.239.http > fedora.37178: Flags [.], cksum 0x56eb (correct), seq 32763:34191, ack 417, win 235, options [nop,nop,TS val 3617786129 ecr 3125106373], length 1428: HTTP
21:11:29.773441 IP (tos 0x0, ttl 44, id 47274, offset 0, flags [DF], proto TCP (6), length 1480)
    45.64.132.239.http > fedora.37178: Flags [.], cksum 0xe639 (correct), seq 34191:35619, ack 417, win 235, options [nop,nop,TS val 3617786129 ecr 3125106373], length 1428: HTTP
21:11:29.773483 IP (tos 0x0, ttl 64, id 25660, offset 0, flags [DF], proto TCP (6), length 52)
    fedora.37178 > 45.64.132.239.http: Flags [.], cksum 0x7366 (incorrect -> 0x129a), ack 35619, win 501, options [nop,nop,TS val 3125106457 ecr 3617786129], length 0
21:11:29.774656 IP (tos 0x0, ttl 44, id 47277, offset 0, flags [DF], proto TCP (6), length 1480)
    45.64.132.239.http > fedora.37178: Flags [.], cksum 0xfe0d (correct), seq 38475:39903, ack 417, win 235, options [nop,nop,TS val 3617786129 ecr 3125106373], length 1428: HTTP
21:11:29.774699 IP (tos 0x0, ttl 64, id 25661, offset 0, flags [DF], proto TCP (6), length 64)
    fedora.37178 > 45.64.132.239.http: Flags [.], cksum 0x7372 (incorrect -> 0xb5ae), ack 35619, win 501, options [nop,nop,TS val 3125106458 ecr 3617786129,nop,nop,sack 1 {38475:39903}], length 0
21:11:29.775847 IP (tos 0x0, ttl 47, id 51762, offset 0, flags [DF], proto TCP (6), length 1480)
    45.64.132.239.http > fedora.37174: Flags [.], cksum 0xd6fb (correct), seq 18483:19911, ack 390, win 235, options [nop,nop,TS val 3617786130 ecr 3125106374], length 1428: HTTP
21:11:29.775890 IP (tos 0x0, ttl 64, id 48079, offset 0, flags [DF], proto TCP (6), length 52)
    fedora.37174 > 45.64.132.239.http: Flags [.], cksum 0x7366 (incorrect -> 0xb30b), ack 19911, win 501, options [nop,nop,TS val 3125106459 ecr 3617786130], length 0
21:11:29.777086 IP (tos 0x0, ttl 44, id 47275, offset 0, flags [DF], proto TCP (6), length 1480)
    45.64.132.239.http > fedora.37178: Flags [.], cksum 0xc1a7 (correct), seq 35619:37047, ack 417, win 235, options [nop,nop,TS val 3617786129 ecr 3125106373], length 1428: HTTP
21:11:29.777147 IP (tos 0x0, ttl 64, id 25662, offset 0, flags [DF], proto TCP (6), length 64)
    fedora.37178 > 45.64.132.239.http: Flags [.], cksum 0x7372 (incorrect -> 0xb01d), ack 37047, win 495, options [nop,nop,TS val 3125106461 ecr 3617786129,nop,nop,sack 1 {38475:39903}], length 0
21:11:29.778293 IP (tos 0x0, ttl 44, id 47276, offset 0, flags [DF], proto TCP (6), length 1480)
    45.64.132.239.http > fedora.37178: Flags [.], cksum 0xeee8 (correct), seq 37047:38475, ack 417, win 235, options [nop,nop,TS val 3617786129 ecr 3125106373], length 1428: HTTP
21:11:29.778349 IP (tos 0x0, ttl 64, id 25663, offset 0, flags [DF], proto TCP (6), length 52)
    fedora.37178 > 45.64.132.239.http: Flags [.], cksum 0x7366 (incorrect -> 0x01df), ack 39903, win 495, options [nop,nop,TS val 3125106462 ecr 3617786129], length 0
21:11:29.779119 IP (tos 0x0, ttl 44, id 47278, offset 0, flags [DF], proto TCP (6), length 1033)
    45.64.132.239.http > fedora.37178: Flags [P.], cksum 0x127d (correct), seq 39903:40884, ack 417, win 235, options [nop,nop,TS val 3617786129 ecr 3125106373], length 981: HTTP
21:11:29.779254 IP (tos 0x0, ttl 64, id 25664, offset 0, flags [DF], proto TCP (6), length 52)
    fedora.37178 > 45.64.132.239.http: Flags [.], cksum 0x7366 (incorrect -> 0xfe02), ack 40884, win 501, options [nop,nop,TS val 3125106463 ecr 3617786129], length 0
21:11:29.780366 IP (tos 0x0, ttl 47, id 51764, offset 0, flags [DF], proto TCP (6), length 1480)
